,product,title,rating,body
0,"SPIDERCASE [3 IN 1] Designed for iPhone 13 Pro Max Case, [Crystal Clear Not Yellowing][with 2 Pcs Tempered Glass Screen Protectors &amp; 2 Pcs Camera Lens Protectors] Slim Thin Case-Clear",Love this case!,5.0,"I really like this case...better than I thought I would. I ordered the clear glitter and my husband got the plain clear.  He said he wishes he got the glitter because it makes the back of the phone look really cool.  Each case came with 2 screen protectors and 2 sets of camera protectors (which are also glitter and very glam). My husband said that the screen protectors are blue light blockers too, I didn't even realize that when I bought them.  I have always been hesitant to purchase a plastic case, but this case is different.  It feels rubbery around the edges. We have Iphone 13 pro max and the cases fit perfectly! For those of you who think it doesn't fit, you got to put a little effort into it, it is supposed to be snug.  I highly recommend these cases!!"
1,"SPIDERCASE [3 IN 1] Designed for iPhone 13 Pro Max Case, [Crystal Clear Not Yellowing][with 2 Pcs Tempered Glass Screen Protectors &amp; 2 Pcs Camera Lens Protectors] Slim Thin Case-Clear",…,5.0,"I was truly happy with my purchase. The case is great, you get a 2 screen protectors and you get a 2 small protectors for your camera. The case fits perfectly and the screen protector has worked great. My only complaint is that I’ve had this for about 2 weeks and the case for my camera has broken. I haven’t dropped my phone. It hasn’t been hit on anything and I was surprised to see that my camera case was broken. So now I’m using the second camera case and currently searching for a new case."
2,"SPIDERCASE [3 IN 1] Designed for iPhone 13 Pro Max Case, [Crystal Clear Not Yellowing][with 2 Pcs Tempered Glass Screen Protectors &amp; 2 Pcs Camera Lens Protectors] Slim Thin Case-Clear",Perfect fit,5.0,"This fit my iPhone 13pro max perfectly. The screen protector fit the screen entirely but leaves just the right amount of space for the case to go on and fit snugly on the phone with out interfering with the screen and vise versa. The camera lens protector is a think protector that fits the shape of the camera lens group and does not interfere with the cameras, even when zoomed all the way out for ultra wide angle. A previous phone and previous case gave me that problem. The lens protector, although thick, does not stick out past the case, everything fits very well together.No info on longevity or durability yet, but I have confidence this will work well for me."
3,"SPIDERCASE [3 IN 1] Designed for iPhone 13 Pro Max Case, [Crystal Clear Not Yellowing][with 2 Pcs Tempered Glass Screen Protectors &amp; 2 Pcs Camera Lens Protectors] Slim Thin Case-Clear",It’s worth your money!! Glitter Case - 2 screen protector- Camera Lens ! Definitely a steal!!,5.0,The media could not be loaded.
4,"SPIDERCASE [3 IN 1] Designed for iPhone 13 Pro Max Case, [Crystal Clear Not Yellowing][with 2 Pcs Tempered Glass Screen Protectors &amp; 2 Pcs Camera Lens Protectors] Slim Thin Case-Clear","Nice combo, screen/camera protectors and the phone case!",5.0,"I like that the screen protector fits nicely inside the case, it covers the entire lit part of the screen, and also covers the notch right up to the ear piece speaker. Very cool! My daughter managed to crack the screen protector within two weeks of installation and the camera protector shortly thereafter, better the protectors than the actual iPhone hardware!"
5,"SPIDERCASE [3 IN 1] Designed for iPhone 13 Pro Max Case, [Crystal Clear Not Yellowing][with 2 Pcs Tempered Glass Screen Protectors &amp; 2 Pcs Camera Lens Protectors] Slim Thin Case-Clear",Worth the money,5.0,"It’s pretty sturdy. I’ve already dropped my phone twice and not scratch or dent on my phone. Lol. It stays pretty snug on the phone so it’s a bit hard to take off if ever needed, but that’s one of the features I love about it. It’s not flimsy. The camera protector that also comes with it is amazing too. It doesn’t obstruct it in any way and the pictures come out as clear as ever. The screen protector is really easy to put on. IMO, it’s worth the money."
6,"SPIDERCASE [3 IN 1] Designed for iPhone 13 Pro Max Case, [Crystal Clear Not Yellowing][with 2 Pcs Tempered Glass Screen Protectors &amp; 2 Pcs Camera Lens Protectors] Slim Thin Case-Clear",Worthy of iPhone,5.0,"Apple should have such a nice case. But then again, it would cost at least 5 times as much from Apple! Only feedback is that it is sometimes difficult to get the camera protector piece to adhere completely clear. The adhesive sometimes shows. Not a major issue though, unless it’s really bad. But they do include two of those in case one doesn’t adhere to your liking."
7,"SPIDERCASE [3 IN 1] Designed for iPhone 13 Pro Max Case, [Crystal Clear Not Yellowing][with 2 Pcs Tempered Glass Screen Protectors &amp; 2 Pcs Camera Lens Protectors] Slim Thin Case-Clear","As a Zookeeper, this case keeps my phone safe and clean!",5.0,"I work a very dirty job and am constantly using my phone all day. It hasn't turned colors, it's durable and really holds the phone in tight. The screen protector is alright, it chipped very easily on the side, but no spider cracks or big issues. It has bumpers on the inside too for the phone corners"
8,"SPIDERCASE [3 IN 1] Designed for iPhone 13 Pro Max Case, [Crystal Clear Not Yellowing][with 2 Pcs Tempered Glass Screen Protectors &amp; 2 Pcs Camera Lens Protectors] Slim Thin Case-Clear",It works,5.0,"Purchased the clear one and I love it. The case works great, screen protector easy to apply, comes with cleaning kit so no dust gets inside the screen protector, feels good, lens protector doesnt affect camera quality, and buttons work great"
9,"SPIDERCASE [3 IN 1] Designed for iPhone 13 Pro Max Case, [Crystal Clear Not Yellowing][with 2 Pcs Tempered Glass Screen Protectors &amp; 2 Pcs Camera Lens Protectors] Slim Thin Case-Clear",Not as thin,5.0,"I was looking for a very thin case for my iPhone 13 pro max, unfortunately this one is standard size. Very durable but not what I was looking for. I do recommend it, if a clear case is what your after."
10,"SPIDERCASE [3 IN 1] Designed for iPhone 13 Pro Max Case, [Crystal Clear Not Yellowing][with 2 Pcs Tempered Glass Screen Protectors &amp; 2 Pcs Camera Lens Protectors] Slim Thin Case-Clear",Great case for the money!,5.0,I bought the clear glitter one and it gives the phone a cool effect while still being able to see the alpine green color of my phone. It comes with super easy to apply screen protectors and even some glitter round covers for the 3 back cameras but I didn’t use them because I felt they look cheap and are not really necessary as the case rises up high enough to protect the cameras when you lay it down. Glad I didn’t pay $50+ for one at the Verizon store!!
11,"SPIDERCASE [3 IN 1] Designed for iPhone 13 Pro Max Case, [Crystal Clear Not Yellowing][with 2 Pcs Tempered Glass Screen Protectors &amp; 2 Pcs Camera Lens Protectors] Slim Thin Case-Clear","Great case, fits the phone perfect",5.0,"The only suggestion i would have is how to include instructions on how to install the screen protector.  I made it work, but have never done this on any prior phones.  Great value for the money."
12,"SPIDERCASE [3 IN 1] Designed for iPhone 13 Pro Max Case, [Crystal Clear Not Yellowing][with 2 Pcs Tempered Glass Screen Protectors &amp; 2 Pcs Camera Lens Protectors] Slim Thin Case-Clear",Decent Case,5.0,Needed a good clear case for my Alpine Green iPhone 13 pro max and this fit the bill. Shipping was fast and it fit my phone very snuggly.
13,"SPIDERCASE [3 IN 1] Designed for iPhone 13 Pro Max Case, [Crystal Clear Not Yellowing][with 2 Pcs Tempered Glass Screen Protectors &amp; 2 Pcs Camera Lens Protectors] Slim Thin Case-Clear",Excelente,5.0,"The media could not be loaded.
                



 Excelente"
14,"SPIDERCASE [3 IN 1] Designed for iPhone 13 Pro Max Case, [Crystal Clear Not Yellowing][with 2 Pcs Tempered Glass Screen Protectors &amp; 2 Pcs Camera Lens Protectors] Slim Thin Case-Clear",Sturdy and was delivered quickly,5.0,"A simple but sturdy case for my phone.  A simple instruction sheet would have probably helped me get it on a bit faster, but overall, not complicated."
15,"SPIDERCASE [3 IN 1] Designed for iPhone 13 Pro Max Case, [Crystal Clear Not Yellowing][with 2 Pcs Tempered Glass Screen Protectors &amp; 2 Pcs Camera Lens Protectors] Slim Thin Case-Clear",As good as it gets,5.0,I've had many iphone covers in my day and this one is the most simple and simply the best. I love it.
16,"SPIDERCASE [3 IN 1] Designed for iPhone 13 Pro Max Case, [Crystal Clear Not Yellowing][with 2 Pcs Tempered Glass Screen Protectors &amp; 2 Pcs Camera Lens Protectors] Slim Thin Case-Clear",Nice clean look,5.0,Very nice and cleaning looking. Not too bulky
17,"SPIDERCASE [3 IN 1] Designed for iPhone 13 Pro Max Case, [Crystal Clear Not Yellowing][with 2 Pcs Tempered Glass Screen Protectors &amp; 2 Pcs Camera Lens Protectors] Slim Thin Case-Clear",Super buena calidad,5.0,Calsa perfecto y protege muy bien el celular
18,"SPIDERCASE [3 IN 1] Designed for iPhone 13 Pro Max Case, [Crystal Clear Not Yellowing][with 2 Pcs Tempered Glass Screen Protectors &amp; 2 Pcs Camera Lens Protectors] Slim Thin Case-Clear",Exactly what I was looking for.,5.0,Fits good and I love that it has the extra covering over the camera lens’s. Just upgraded to the 13 pro and the first day was so worried I was going to scratch it given how far the lens stuck out. Put it on and can comfortably set my phone down with no worries if any scratching. For a $20 or so case couldn’t ask for much more
19,"SPIDERCASE [3 IN 1] Designed for iPhone 13 Pro Max Case, [Crystal Clear Not Yellowing][with 2 Pcs Tempered Glass Screen Protectors &amp; 2 Pcs Camera Lens Protectors] Slim Thin Case-Clear",Excelente articulo.,5.0,Excelente protector para Iphone 13 pro max.
20,"SPIDERCASE [3 IN 1] Designed for iPhone 13 Pro Max Case, [Crystal Clear Not Yellowing][with 2 Pcs Tempered Glass Screen Protectors &amp; 2 Pcs Camera Lens Protectors] Slim Thin Case-Clear",Good looking case,5.0,Slim feel and looks good
21,"SPIDERCASE [3 IN 1] Designed for iPhone 13 Pro Max Case, [Crystal Clear Not Yellowing][with 2 Pcs Tempered Glass Screen Protectors &amp; 2 Pcs Camera Lens Protectors] Slim Thin Case-Clear",Durable,5.0,Good so far! It’s better than I expected tbh. Easy to place both screen and camera protector and case is thin but thick enough to protect phone. I would recommend. I love that two were sent just in case.
22,"SPIDERCASE [3 IN 1] Designed for iPhone 13 Pro Max Case, [Crystal Clear Not Yellowing][with 2 Pcs Tempered Glass Screen Protectors &amp; 2 Pcs Camera Lens Protectors] Slim Thin Case-Clear",Its just like the cases sold at the ATT store without the big price tag.,5.0,Looks great and fits great and saved me a lot of money.
23,"SPIDERCASE [3 IN 1] Designed for iPhone 13 Pro Max Case, [Crystal Clear Not Yellowing][with 2 Pcs Tempered Glass Screen Protectors &amp; 2 Pcs Camera Lens Protectors] Slim Thin Case-Clear",A reasonable investment to protect a valuable tool,5.0,It's not too bulky
24,"SPIDERCASE [3 IN 1] Designed for iPhone 13 Pro Max Case, [Crystal Clear Not Yellowing][with 2 Pcs Tempered Glass Screen Protectors &amp; 2 Pcs Camera Lens Protectors] Slim Thin Case-Clear",Beautiful case,5.0,"I love my glittery case, it catches other’s eyes. Most importantly, it has my iPhone 13 secure! I am super happy with my purchase."
25,"SPIDERCASE [3 IN 1] Designed for iPhone 13 Pro Max Case, [Crystal Clear Not Yellowing][with 2 Pcs Tempered Glass Screen Protectors &amp; 2 Pcs Camera Lens Protectors] Slim Thin Case-Clear",Quality,5.0,The case quality is great.
26,"SPIDERCASE [3 IN 1] Designed for iPhone 13 Pro Max Case, [Crystal Clear Not Yellowing][with 2 Pcs Tempered Glass Screen Protectors &amp; 2 Pcs Camera Lens Protectors] Slim Thin Case-Clear",Good,5.0,Good
27,"SPIDERCASE [3 IN 1] Designed for iPhone 13 Pro Max Case, [Crystal Clear Not Yellowing][with 2 Pcs Tempered Glass Screen Protectors &amp; 2 Pcs Camera Lens Protectors] Slim Thin Case-Clear",Fit great,5.0,Very good price
28,"SPIDERCASE [3 IN 1] Designed for iPhone 13 Pro Max Case, [Crystal Clear Not Yellowing][with 2 Pcs Tempered Glass Screen Protectors &amp; 2 Pcs Camera Lens Protectors] Slim Thin Case-Clear",Perfect item,5.0,Item adds another dimension to iPhone
29,"SPIDERCASE [3 IN 1] Designed for iPhone 13 Pro Max Case, [Crystal Clear Not Yellowing][with 2 Pcs Tempered Glass Screen Protectors &amp; 2 Pcs Camera Lens Protectors] Slim Thin Case-Clear",Expectations met,5.0,Expectations
30,"SPIDERCASE [3 IN 1] Designed for iPhone 13 Pro Max Case, [Crystal Clear Not Yellowing][with 2 Pcs Tempered Glass Screen Protectors &amp; 2 Pcs Camera Lens Protectors] Slim Thin Case-Clear",Reliable and inexpensive,5.0,"This is a great phone case if you are trying to save money and want something reliable.Even if it’s just for a temporary case until you can get a preferred style, still worth it.Especially since it comes with two screen protectors and two camera lens protectors."
31,"SPIDERCASE [3 IN 1] Designed for iPhone 13 Pro Max Case, [Crystal Clear Not Yellowing][with 2 Pcs Tempered Glass Screen Protectors &amp; 2 Pcs Camera Lens Protectors] Slim Thin Case-Clear",Great product,5.0,This screen protector was the best I have ever had to install.  Not one bubble! The case is great and the cover for the camera is very durable.  I can’t believe it was so cheap to purchase.
32,"SPIDERCASE [3 IN 1] Designed for iPhone 13 Pro Max Case, [Crystal Clear Not Yellowing][with 2 Pcs Tempered Glass Screen Protectors &amp; 2 Pcs Camera Lens Protectors] Slim Thin Case-Clear",Good case,5.0,"Thin but sturdy, and it’s so pretty!"
33,"SPIDERCASE [3 IN 1] Designed for iPhone 13 Pro Max Case, [Crystal Clear Not Yellowing][with 2 Pcs Tempered Glass Screen Protectors &amp; 2 Pcs Camera Lens Protectors] Slim Thin Case-Clear",Nice design. Easy to install.,5.0,Nice clear cover plus glass protection.
34,"SPIDERCASE [3 IN 1] Designed for iPhone 13 Pro Max Case, [Crystal Clear Not Yellowing][with 2 Pcs Tempered Glass Screen Protectors &amp; 2 Pcs Camera Lens Protectors] Slim Thin Case-Clear",Great cast,5.0,Thin but sturdy
35,"SPIDERCASE [3 IN 1] Designed for iPhone 13 Pro Max Case, [Crystal Clear Not Yellowing][with 2 Pcs Tempered Glass Screen Protectors &amp; 2 Pcs Camera Lens Protectors] Slim Thin Case-Clear",Great product and a great deal,5.0,It gives total protection for your phone.
36,"SPIDERCASE [3 IN 1] Designed for iPhone 13 Pro Max Case, [Crystal Clear Not Yellowing][with 2 Pcs Tempered Glass Screen Protectors &amp; 2 Pcs Camera Lens Protectors] Slim Thin Case-Clear",Great!,5.0,"Great case, sturdy and protects. Also comes with the 2 screen protectors and 2 camera ones too! And they work great and easy to put on."
37,"SPIDERCASE [3 IN 1] Designed for iPhone 13 Pro Max Case, [Crystal Clear Not Yellowing][with 2 Pcs Tempered Glass Screen Protectors &amp; 2 Pcs Camera Lens Protectors] Slim Thin Case-Clear",Very nice,5.0,I love this case
38,"SPIDERCASE [3 IN 1] Designed for iPhone 13 Pro Max Case, [Crystal Clear Not Yellowing][with 2 Pcs Tempered Glass Screen Protectors &amp; 2 Pcs Camera Lens Protectors] Slim Thin Case-Clear",I love it best purchase I made,5.0,This is a awesome purchase it is clear and you can see the phone color through the case and it has camera guards I love it
39,"SPIDERCASE [3 IN 1] Designed for iPhone 13 Pro Max Case, [Crystal Clear Not Yellowing][with 2 Pcs Tempered Glass Screen Protectors &amp; 2 Pcs Camera Lens Protectors] Slim Thin Case-Clear",Perfect fit,5.0,This case is a perfect fit for the phone. I have bought a few cases at different places and this is by far the best.
40,"SPIDERCASE [3 IN 1] Designed for iPhone 13 Pro Max Case, [Crystal Clear Not Yellowing][with 2 Pcs Tempered Glass Screen Protectors &amp; 2 Pcs Camera Lens Protectors] Slim Thin Case-Clear",very light,5.0,"This case was very light. I like the style and it was not expensive. Also, like the lens cover which is really protective."
41,"SPIDERCASE [3 IN 1] Designed for iPhone 13 Pro Max Case, [Crystal Clear Not Yellowing][with 2 Pcs Tempered Glass Screen Protectors &amp; 2 Pcs Camera Lens Protectors] Slim Thin Case-Clear",great quality,5.0,Great quality and love the color.  Thank you!
42,"SPIDERCASE [3 IN 1] Designed for iPhone 13 Pro Max Case, [Crystal Clear Not Yellowing][with 2 Pcs Tempered Glass Screen Protectors &amp; 2 Pcs Camera Lens Protectors] Slim Thin Case-Clear",Very good,5.0,Very good
43,"SPIDERCASE [3 IN 1] Designed for iPhone 13 Pro Max Case, [Crystal Clear Not Yellowing][with 2 Pcs Tempered Glass Screen Protectors &amp; 2 Pcs Camera Lens Protectors] Slim Thin Case-Clear",Perfect,5.0,It has everything you need and love that it was exactly what the pictures describe it is.
44,"SPIDERCASE [3 IN 1] Designed for iPhone 13 Pro Max Case, [Crystal Clear Not Yellowing][with 2 Pcs Tempered Glass Screen Protectors &amp; 2 Pcs Camera Lens Protectors] Slim Thin Case-Clear",Great product!,5.0,"Love it, it’s amazing totally worth it!"
45,"SPIDERCASE [3 IN 1] Designed for iPhone 13 Pro Max Case, [Crystal Clear Not Yellowing][with 2 Pcs Tempered Glass Screen Protectors &amp; 2 Pcs Camera Lens Protectors] Slim Thin Case-Clear",Great look at great price,5.0,Came timely and has a very high quality for the price paid. My wife loved it
46,"SPIDERCASE [3 IN 1] Designed for iPhone 13 Pro Max Case, [Crystal Clear Not Yellowing][with 2 Pcs Tempered Glass Screen Protectors &amp; 2 Pcs Camera Lens Protectors] Slim Thin Case-Clear",Really nice,5.0,Nice case and comes with an extra screen protector and lens protector. By far best value for the money! Good product
47,"SPIDERCASE [3 IN 1] Designed for iPhone 13 Pro Max Case, [Crystal Clear Not Yellowing][with 2 Pcs Tempered Glass Screen Protectors &amp; 2 Pcs Camera Lens Protectors] Slim Thin Case-Clear",Simple and fits great,5.0,Great scratch resistance.
48,"SPIDERCASE [3 IN 1] Designed for iPhone 13 Pro Max Case, [Crystal Clear Not Yellowing][with 2 Pcs Tempered Glass Screen Protectors &amp; 2 Pcs Camera Lens Protectors] Slim Thin Case-Clear",Love it,5.0,Absolutely love this item great fit for my iPhone 13 !!
49,"SPIDERCASE [3 IN 1] Designed for iPhone 13 Pro Max Case, [Crystal Clear Not Yellowing][with 2 Pcs Tempered Glass Screen Protectors &amp; 2 Pcs Camera Lens Protectors] Slim Thin Case-Clear",Great Value for the money!,5.0,Really love this!!
50,"SPIDERCASE [3 IN 1] Designed for iPhone 13 Pro Max Case, [Crystal Clear Not Yellowing][with 2 Pcs Tempered Glass Screen Protectors &amp; 2 Pcs Camera Lens Protectors] Slim Thin Case-Clear",Genial,5.0,Todo tal cual 100% recomendado
51,"SPIDERCASE [3 IN 1] Designed for iPhone 13 Pro Max Case, [Crystal Clear Not Yellowing][with 2 Pcs Tempered Glass Screen Protectors &amp; 2 Pcs Camera Lens Protectors] Slim Thin Case-Clear",Amazing,5.0,"This product is so amazing, I love is. It deserves more that 5 start"
52,"SPIDERCASE [3 IN 1] Designed for iPhone 13 Pro Max Case, [Crystal Clear Not Yellowing][with 2 Pcs Tempered Glass Screen Protectors &amp; 2 Pcs Camera Lens Protectors] Slim Thin Case-Clear",All in one,5.0,Love that I can buy one thing & protect my whole phone
53,"SPIDERCASE [3 IN 1] Designed for iPhone 13 Pro Max Case, [Crystal Clear Not Yellowing][with 2 Pcs Tempered Glass Screen Protectors &amp; 2 Pcs Camera Lens Protectors] Slim Thin Case-Clear",Good product,5.0,Exactly as shown. Very pleased
54,"SPIDERCASE [3 IN 1] Designed for iPhone 13 Pro Max Case, [Crystal Clear Not Yellowing][with 2 Pcs Tempered Glass Screen Protectors &amp; 2 Pcs Camera Lens Protectors] Slim Thin Case-Clear",Good,5.0,Good
55,"SPIDERCASE [3 IN 1] Designed for iPhone 13 Pro Max Case, [Crystal Clear Not Yellowing][with 2 Pcs Tempered Glass Screen Protectors &amp; 2 Pcs Camera Lens Protectors] Slim Thin Case-Clear",Yay,5.0,Na
56,"SPIDERCASE [3 IN 1] Designed for iPhone 13 Pro Max Case, [Crystal Clear Not Yellowing][with 2 Pcs Tempered Glass Screen Protectors &amp; 2 Pcs Camera Lens Protectors] Slim Thin Case-Clear",Great value,5.0,It comes with two screen and camera protectors!
57,"SPIDERCASE [3 IN 1] Designed for iPhone 13 Pro Max Case, [Crystal Clear Not Yellowing][with 2 Pcs Tempered Glass Screen Protectors &amp; 2 Pcs Camera Lens Protectors] Slim Thin Case-Clear",Thumbs Up ni,5.0,"The media could not be loaded.
                



 Good product"
58,"SPIDERCASE [3 IN 1] Designed for iPhone 13 Pro Max Case, [Crystal Clear Not Yellowing][with 2 Pcs Tempered Glass Screen Protectors &amp; 2 Pcs Camera Lens Protectors] Slim Thin Case-Clear",Nicely done,5.0,Fits perfectly snug on an iPhone 13 Pro Max
59,"SPIDERCASE [3 IN 1] Designed for iPhone 13 Pro Max Case, [Crystal Clear Not Yellowing][with 2 Pcs Tempered Glass Screen Protectors &amp; 2 Pcs Camera Lens Protectors] Slim Thin Case-Clear",Good value for the price.,5.0,Great product.
60,"SPIDERCASE [3 IN 1] Designed for iPhone 13 Pro Max Case, [Crystal Clear Not Yellowing][with 2 Pcs Tempered Glass Screen Protectors &amp; 2 Pcs Camera Lens Protectors] Slim Thin Case-Clear",very good and excellent,5.0,Very good and excellent and love it
61,"SPIDERCASE [3 IN 1] Designed for iPhone 13 Pro Max Case, [Crystal Clear Not Yellowing][with 2 Pcs Tempered Glass Screen Protectors &amp; 2 Pcs Camera Lens Protectors] Slim Thin Case-Clear",Excellent,5.0,Todo bien
62,"SPIDERCASE [3 IN 1] Designed for iPhone 13 Pro Max Case, [Crystal Clear Not Yellowing][with 2 Pcs Tempered Glass Screen Protectors &amp; 2 Pcs Camera Lens Protectors] Slim Thin Case-Clear",Awesome case,5.0,Nice case
63,"SPIDERCASE [3 IN 1] Designed for iPhone 13 Pro Max Case, [Crystal Clear Not Yellowing][with 2 Pcs Tempered Glass Screen Protectors &amp; 2 Pcs Camera Lens Protectors] Slim Thin Case-Clear",Excelente,5.0,Todo perfecto
64,"SPIDERCASE [3 IN 1] Designed for iPhone 13 Pro Max Case, [Crystal Clear Not Yellowing][with 2 Pcs Tempered Glass Screen Protectors &amp; 2 Pcs Camera Lens Protectors] Slim Thin Case-Clear",Great all around protective case for iPhone 13 Pro Max,5.0,I just got my first promax this month over from an iPhone 11. I had to get a case quickly so I did a quick look in Amazon for this case I saw I had a protective cover for the lenses and I work for AT&T when are the things that breaks on phones it’s not just the screen but it’s the lens of the camera. I was glad that I have had a protection towards that as well this kit came with two protective lens covers and two protective screen protectors. Plus the case the case fits flawlessly has no gaps and it doesn’t make it feel much more bulky. I hadn’t dropped it yet  but I hope it protects like it says online. I’ve been recommended it to my customers when I threw some out of T-Mobile and Verizon and getting this protective case and others protective cases from Spider Case !!!
65,"SPIDERCASE [3 IN 1] Designed for iPhone 13 Pro Max Case, [Crystal Clear Not Yellowing][with 2 Pcs Tempered Glass Screen Protectors &amp; 2 Pcs Camera Lens Protectors] Slim Thin Case-Clear",For the 13 pro max spend the extra 20,4.0,"I do feel like the drop protection is good. Case is nice, but edges are not comfortable in landscape mode. I play mobile games a lot so it depends on intended usage. But for everyday use it’s a good case for under $20. They include accessories as well-"
66,"SPIDERCASE [3 IN 1] Designed for iPhone 13 Pro Max Case, [Crystal Clear Not Yellowing][with 2 Pcs Tempered Glass Screen Protectors &amp; 2 Pcs Camera Lens Protectors] Slim Thin Case-Clear",It cut me!,4.0,The camera cover thingy cut me! 1st of all I didn’t even drop my phone it cracked when I took the case off. Then after leaving it on thinking it wasn’t that bad it crumble started chipping and cut my hand when I went the retrieve it! It really hurt. So I took it off but now am scared to replace it broke so easily and it’s like glass! Do upset! And I should have got the case the has the circle for charging anyway!! That’s why I had to remove the case! All around bad purchase for me. Case is ok kinda hard to remove but cool.. glass lense cover sucks!
67,"SPIDERCASE [3 IN 1] Designed for iPhone 13 Pro Max Case, [Crystal Clear Not Yellowing][with 2 Pcs Tempered Glass Screen Protectors &amp; 2 Pcs Camera Lens Protectors] Slim Thin Case-Clear",My Wife Loved it,4.0,It's simple and decorative.I was unsure of buying such a low-priced iPhone protector because my wife is used to more expensive and elegant accessories But I wanted something made from a material that would actually safeguard her phone from dropping it.She loves it
68,"SPIDERCASE [3 IN 1] Designed for iPhone 13 Pro Max Case, [Crystal Clear Not Yellowing][with 2 Pcs Tempered Glass Screen Protectors &amp; 2 Pcs Camera Lens Protectors] Slim Thin Case-Clear",Quality,1.0,"Product was not good screens cracked , had to buy a different one today . I would not recommend this product at all . It cost more money because I had to buy another oneSincerelyJane Hosner"
69,"SPIDERCASE [3 IN 1] Designed for iPhone 13 Pro Max Case, [Crystal Clear Not Yellowing][with 2 Pcs Tempered Glass Screen Protectors &amp; 2 Pcs Camera Lens Protectors] Slim Thin Case-Clear",Broken,2.0,The protection screen broke 1st day I had it and didn’t even drop it. Just sat it on counter and it cracked.
70,"SPIDERCASE [3 IN 1] Designed for iPhone 13 Pro Max Case, [Crystal Clear Not Yellowing][with 2 Pcs Tempered Glass Screen Protectors &amp; 2 Pcs Camera Lens Protectors] Slim Thin Case-Clear",Good Case,4.0,"Comes with 2 screen protectors, which is great. The case is easy to snap on. Only wish that the cover for the lenses was one piece instead of 3 separate pieces. But overall, it’s a good case."
